{
  "$schema": "./threat-model.schema.json",
  "schemaVersion": "1.0.0",
  "releaseTrainId": "oc-2026.7.1-2-locked.1",
  "method": "STRIDE-plus-agentic-abuse-cases",
  "assets": [
    { "id": "A-01", "name": "Static secret và OAuth token", "impact": "Chiếm tài khoản provider, phát sinh chi phí hoặc truy cập dữ liệu" },
    { "id": "A-02", "name": "Dữ liệu doanh nghiệp và artifact", "impact": "Rò rỉ, sửa sai hoặc mất tài sản nghiệp vụ" },
    { "id": "A-03", "name": "Danh tính, memory và ranh giới Agent", "impact": "Mạo danh, ghi nhớ độc hại hoặc trộn dữ liệu Agent" },
    { "id": "A-04", "name": "Quyền tool, browser, file và node", "impact": "Hành động vượt ý định người dùng hoặc chiếm máy" },
    { "id": "A-05", "name": "Approval và audit trail", "impact": "Không truy được trách nhiệm hoặc hành động nhạy cảm không được duyệt" },
    { "id": "A-06", "name": "Release train, installer và updater", "impact": "Thực thi mã bị cấy hoặc downgrade bảo mật" },
    { "id": "A-07", "name": "Session, transcript và Advisor verdict", "impact": "Sai kết quả, rò riêng tư hoặc phê duyệt giả" },
    { "id": "A-08", "name": "Ngân sách model và tài nguyên máy", "impact": "Denial-of-wallet, treo máy hoặc gián đoạn dịch vụ" },
    { "id": "A-09", "name": "Backup và khả năng phục hồi", "impact": "Mất dữ liệu, cấy state cũ hoặc khôi phục credential không an toàn" },
    { "id": "A-10", "name": "Biên khách hàng Always-on", "impact": "Trộn hoặc lộ dữ liệu giữa các khách hàng" }
  ],
  "actors": [
    { "id": "ACT-01", "name": "Người dùng hợp lệ nhưng nhầm lẫn", "access": "Có quyền thao tác UI và phê duyệt trong tài khoản của mình" },
    { "id": "ACT-02", "name": "Nội dung ngoài độc hại", "access": "Web, email, PDF, OCR, tool output, prompt hoặc artifact được Agent đọc" },
    { "id": "ACT-03", "name": "Renderer hoặc nội dung web bị khai thác", "access": "Có thể gọi IPC nếu lớp Main không xác minh sender/schema" },
    { "id": "ACT-04", "name": "Process lạ cùng OS user hoặc network peer", "access": "Có thể dò port, socket, argv, log hoặc file có ACL yếu" },
    { "id": "ACT-05", "name": "Plugin, skill hoặc MCP độc hại/bị thay đổi", "access": "Chạy trong capability surface đã được cài hoặc kết nối" },
    { "id": "ACT-06", "name": "Provider hoặc callback giả mạo", "access": "Điều khiển phản hồi mạng, redirect hoặc lỗi auth" },
    { "id": "ACT-07", "name": "Thiết bị/channel đã pair nhưng bị chiếm", "access": "Có delegated authority theo scope đã cấp" },
    { "id": "ACT-08", "name": "Kẻ tấn công chuỗi cung ứng", "access": "Tác động dependency, artifact, update hoặc distribution metadata" },
    { "id": "ACT-09", "name": "Khách hàng khác trên hạ tầng remote", "access": "Có account hoặc instance riêng nhưng cố vượt tenant boundary" },
    { "id": "ACT-10", "name": "Model hoặc Agent tự mở rộng hành động", "access": "Có thể đề xuất tool call, delegation, memory write hoặc approval request" }
  ],
  "trustBoundaries": [
    { "id": "TB-01", "name": "Người dùng/Renderer sang Main/Supervisor", "from": "Untrusted or compromiseable UI", "to": "Privileged desktop control plane", "defaultControl": "contextIsolation, sandboxed renderer, schema IPC, sender validation and capability allowlist" },
    { "id": "TB-02", "name": "Main/Supervisor sang Gateway", "from": "AI for Boss privileged process", "to": "OpenClaw trusted operator domain", "defaultControl": "Loopback, dynamic endpoint, scoped client identity, Supervisor-owned credential and protocol validation" },
    { "id": "TB-03", "name": "Máy khách sang Internet/provider", "from": "Local trusted components", "to": "External network and provider", "defaultControl": "Deny-by-default egress, allowlisted destination, TLS, explicit provider and visible data egress" },
    { "id": "TB-04", "name": "Runtime sang host/workspace", "from": "Agent/tool/browser runtime", "to": "Host filesystem, process and devices", "defaultControl": "Sandbox backend, least privilege, canonical path policy, quarantine and approval" },
    { "id": "TB-05", "name": "Agent Home sang Không gian dự án", "from": "Agent identity and memory domain", "to": "User-owned business data domain", "defaultControl": "Separate paths and source-of-truth, explicit none/read-only/read-write grant, no link escape" },
    { "id": "TB-06", "name": "Worker sang Advisor", "from": "Untrusted worker output", "to": "Independent review session", "defaultControl": "Minimal review package, output-as-data marking, read-only permissions and schema-validated verdict" },
    { "id": "TB-07", "name": "Core sang extension/channel", "from": "OpenClaw and AI for Boss core", "to": "Plugin, skill, MCP, channel and hook", "defaultControl": "Provenance, hash, permission diff, allowlist, quarantine and revoke" },
    { "id": "TB-08", "name": "Desktop sang Always-on", "from": "Remote client and network", "to": "Customer-owned private instance", "defaultControl": "Private ingress, expiring one-time claim, device identity, least scope and per-customer instance" },
    { "id": "TB-09", "name": "Live state sang backup/update/support artifact", "from": "Sensitive local state", "to": "Portable or external artifact", "defaultControl": "Encryption, signature, redaction, verification, staging and user-initiated export" },
    { "id": "TB-10", "name": "OS account sang principal khác", "from": "AI for Boss profile and IPC endpoints", "to": "Other local users, services or devices", "defaultControl": "Per-user ACL, protected IPC, separate OS user/host for real trust separation and full-disk encryption recommendation" }
  ],
  "threats": [
    {
      "id": "T-01",
      "title": "Artifact, dependency hoặc update bị cấy/sửa",
      "category": "supply-chain",
      "actorRefs": ["ACT-08"],
      "assetRefs": ["A-06", "A-01", "A-02"],
      "boundaryRefs": ["TB-03", "TB-09"],
      "abuseCases": ["Installer bị thay thế", "Dependency drift khỏi lock", "Updater nhận artifact downgrade hoặc sai kiến trúc"],
      "requiredControls": ["Pinned release train", "SBOM and license inventory", "Clean reproducible build", "Signature and checksum verification", "Rollback manifest and downgrade protection"],
      "failClosedBehavior": "Reject artifact and keep the previous verified bundle.",
      "evidenceGate": "Feature 0.5 policy, Gate 4 signed-artifact tamper and rollback tests",
      "riskRefs": ["R-005", "R-016", "R-017", "R-024"],
      "residualRisk": { "severity": "Critical", "status": "open", "reason": "No signing identities or production updater exist." }
    },
    {
      "id": "T-02",
      "title": "Gateway, Supervisor hoặc remote instance giả mạo",
      "category": "spoofing",
      "actorRefs": ["ACT-04", "ACT-09"],
      "assetRefs": ["A-01", "A-04", "A-07", "A-10"],
      "boundaryRefs": ["TB-02", "TB-08", "TB-10"],
      "abuseCases": ["Process lạ chiếm fixed port", "Client nối nhầm Gateway của app khác", "Remote endpoint giả nhận credential hoặc command"],
      "requiredControls": ["Supervisor-only process ownership", "Dynamic endpoint", "Device identity and scoped handshake", "Build ID and release train checks", "Private ingress and certificate/host verification"],
      "failClosedBehavior": "Do not adopt, kill or connect to the unknown process; enter diagnostic state.",
      "evidenceGate": "Gate 1 foreign-process tests and Gate 4 remote identity tests",
      "riskRefs": ["R-005", "R-020", "R-023"],
      "residualRisk": { "severity": "High", "status": "mitigated-by-design-untested", "reason": "The ownership and identity contracts are specified but not implemented." }
    },
    {
      "id": "T-03",
      "title": "Static secret, OAuth token hoặc backup secret bị lộ",
      "category": "information-disclosure",
      "actorRefs": ["ACT-03", "ACT-04", "ACT-08"],
      "assetRefs": ["A-01", "A-09"],
      "boundaryRefs": ["TB-01", "TB-02", "TB-09", "TB-10"],
      "abuseCases": ["Secret lọt renderer, argv, log hoặc crash dump", "Auth store ACL yếu", "Support bundle hoặc backup mang token không được mã hóa"],
      "requiredControls": ["OS key store via tested SecretRef for static secret", "OpenClaw native auth store with per-user ACL for OAuth", "No-secret IPC/argv/log", "Encrypted full backup", "Redaction plus post-export inspection"],
      "failClosedBehavior": "Disable connector, revoke credential when exposure is suspected and produce a secret-free incident record.",
      "evidenceGate": "Feature 0.5 secret baseline, three-OS SecretRef contract, support-bundle and restore tests",
      "riskRefs": ["R-002", "R-003", "R-006"],
      "residualRisk": { "severity": "Critical", "status": "open", "reason": "Credential Broker and redaction pipeline are not implemented." }
    },
    {
      "id": "T-04",
      "title": "OAuth state/callback bị dùng lại, tráo hoặc hết phiên",
      "category": "spoofing",
      "actorRefs": ["ACT-01", "ACT-06"],
      "assetRefs": ["A-01", "A-07"],
      "boundaryRefs": ["TB-01", "TB-03"],
      "abuseCases": ["Dán callback cũ", "State không khớp", "Authorization code replay", "Người dùng login nhầm account"],
      "requiredControls": ["PKCE and state", "Fresh auth session", "Single-use code", "Account confirmation", "Runtime commit plus live probe before success"],
      "failClosedBehavior": "Discard temporary auth state and require a fresh sign-in; never accept pasted partial query strings.",
      "evidenceGate": "Feature 1.4 dedicated-account OAuth adversarial suite",
      "riskRefs": ["R-003"],
      "residualRisk": { "severity": "High", "status": "open", "reason": "End-to-end product OAuth has not been implemented or tested." }
    },
    {
      "id": "T-05",
      "title": "One-time claim, pairing hoặc scope upgrade bị chiếm",
      "category": "elevation-of-privilege",
      "actorRefs": ["ACT-04", "ACT-07", "ACT-09"],
      "assetRefs": ["A-01", "A-04", "A-10"],
      "boundaryRefs": ["TB-02", "TB-08"],